Position,Company,Location,URL
Senior Full stack React Developer,Lemon.io,Europe/Latin America/Canada/Ukraine/United Kingdom,https://remoteok.com/l/410839
Senior/Staff Software Engineer - Backend/Python - USA (100% Remote),Close,USA Only,https://weworkremotely.com/remote-jobs/close-senior-staff-software-engineer-backend-python-usa-100-remote
Senior Platform Engineer,Tactiq,Anywhere in the World,https://weworkremotely.com/remote-jobs/tactiq-senior-platform-engineer
EU Automation QA,SportyBet,Europe Only/UK Only,https://weworkremotely.com/remote-jobs/sportybet-eu-automation-qa-1
EU Backend Engineer,SportyBet,Europe Only/UK Only,https://weworkremotely.com/remote-jobs/sportybet-eu-backend-engineer
Lead Python Developer,Tactiq Tech,Anywhere in the World,https://weworkremotely.com/remote-jobs/tactiq-tech-lead-python-developer
Senior Ruby on Rails - (USD $80-120k),QuickMail,Europe Only,https://weworkremotely.com/remote-jobs/quickmail-senior-ruby-on-rails-usd-80-120k
Senior Backend Engineer,Toggl,Europe Only,https://weworkremotely.com/remote-jobs/toggl-senior-backend-engineer-1
Senior Back-end developer (PHP/ Symfony/ PostgreSQL),TextMagic,Anywhere in the World,https://weworkremotely.com/remote-jobs/textmagic-senior-back-end-developer-php-symfony-postgresql-1
Senior PHP Developer,OnTheGoSystems,Anywhere in the World,https://weworkremotely.com/remote-jobs/onthegosystems-senior-php-developer
Backend Go Developer - Remote,G2i Inc.,Latin America Only,https://weworkremotely.com/remote-jobs/g2i-inc-backend-go-developer-remote
Backend Platform Developer,Waldo Photos,Anywhere in the World,https://weworkremotely.com/remote-jobs/waldo-photos-backend-platform-developer
Senior Software Engineer/ Full Stack,Doximity,USA Only,https://weworkremotely.com/remote-jobs/doximity-senior-software-engineer-full-stack
Modern C++ Software Developer – Remote,XM,Anywhere in the World,https://weworkremotely.com/remote-jobs/xm-modern-cpp-software-developer-remote-2
Senior PHP Web Developers– Cyprus/ Greece or Remote,XM,Anywhere in the World,https://weworkremotely.com/remote-jobs/xm-senior-php-web-developers-cyprus-greece-or-remote-2
Senior Django Developer,Proxify AB,Latin America Only/Europe Only/EMEA Only,https://weworkremotely.com/remote-jobs/proxify-ab-senior-django-developer
Senior Backend Developer - Rails,Big Cartel,USA Only,https://weworkremotely.com/remote-jobs/big-cartel-senior-backend-developer-rails
Senior Python Engineer,Shake,Anywhere in the World,https://weworkremotely.com/remote-jobs/shake-senior-python-engineer-2
Backend Developer,TempMee,Anywhere in the World,https://weworkremotely.com/remote-jobs/tempmee-backend-developer
Blockchain Engineer for a security service,Heim,Anywhere in the World,https://weworkremotely.com/remote-jobs/heim-blockchain-engineer-for-a-security-service
Backend Engineer with Rust,CoW Protocol,Anywhere in the World,https://weworkremotely.com/remote-jobs/cow-protocol-backend-engineer-with-rust-1
Senior Laravel Developer: Long-Term Job - 100% Remote,Proxify AB,Latin America Only/Europe Only/EMEA Only,https://weworkremotely.com/remote-jobs/proxify-ab-senior-laravel-developer-long-term-job-100-remote
Senior Ruby on Rails Developer: Fully Remote,Proxify AB,Anywhere in the World,https://weworkremotely.com/remote-jobs/proxify-ab-senior-ruby-on-rails-developer-fully-remote
Python Flask User Workspace Developer,DataExplorer,Anywhere in the World,https://weworkremotely.com/remote-jobs/dataexplorer-python-flask-user-workspace-developer
Senior Unreal Engine Developer,Proxify AB,Latin America Only/Europe Only/EMEA Only,https://weworkremotely.com/remote-jobs/proxify-ab-senior-unreal-engine-developer-1
Site Reliability Engineer,Sticker Mule,Anywhere in the World,https://weworkremotely.com/remote-jobs/sticker-mule-site-reliability-engineer-1
